{
  "schema_version": 1,
  "model_id": "rotated-one-stud",
  "name": "Rotated one-stud connection",
  "parts": [
    {"id": "base", "part": "3004.dat", "colour": 4, "translation_ldu": [0, 0, 0], "matrix": [1, 0, 0, 0, 1, 0, 0, 0, 1]},
    {"id": "upper", "part": "3004.dat", "colour": 1, "translation_ldu": [10, -24, 10], "matrix": [0, 0, 1, 0, 1, 0, -1, 0, 0]}
  ]
}
