{
  "schema_version": 1,
  "model_id": "tiny-blue-step",
  "name": "Tiny blue step",
  "parts": [
    {"id": "lower", "part": "3020.dat", "colour": 1, "translation_ldu": [10, 0, 10], "matrix": [1, 0, 0, 0, 1, 0, 0, 0, 1]},
    {"id": "upper", "part": "3023.dat", "colour": 1, "translation_ldu": [10, -8, 20], "matrix": [1, 0, 0, 0, 1, 0, 0, 0, 1]}
  ]
}
